{"eventId":"evt_3ce6bb5e7cabc71c19cf4f2181cd3102","eventName":"video.review-status.changed","occurredAt":"2026-07-18T00:03:00.000Z","payload":{"reasonCode":"policy_passed","reviewStatus":"approved"},"revision":2,"schemaVersion":"scp.integration-event.v2","source":"flu","subject":{"applicationId":"application-001","campaignId":"campaign-summer","outreachId":"outreach-001","programId":"program-view-cpm","reviewId":"review-001","videoSubmissionId":"video-submission-001","youtubeVideoId":"abcDEF_123"},"traceId":"tr_contract_trace_001"}
