{"eventId":"evt_801022151d44c4e245cd02ece46d0a73","eventName":"application.submitted","occurredAt":"2026-07-18T00:00:00.000Z","payload":{"applicationStatus":"submitted","locale":"en","uidPolicy":"required_before_gem"},"revision":1,"schemaVersion":"scp.integration-event.v2","source":"portal","subject":{"applicationId":"application-001","campaignId":"campaign-summer","outreachId":"outreach-001","programId":"program-view-cpm","uidGrantId":"uid-grant-001"},"traceId":"tr_contract_trace_001"}
