{"eventId":"evt_351a90c0c4d9e605d9571b5523394f90","eventName":"uid.submitted","occurredAt":"2026-07-18T00:01:00.000Z","payload":{"maskedUid":"******7890","uidLookupHmac":"aaaaaaaaaaaaaaaaaaaaaaaaaaaaaaaaaaaaaaaaaaaaaaaaaaaaaaaaaaaaaaaa","validationStatus":"submitted"},"revision":1,"schemaVersion":"scp.integration-event.v2","source":"portal","subject":{"applicationId":"application-001","campaignId":"campaign-summer","outreachId":"outreach-001","programId":"program-view-cpm","uidGrantId":"uid-grant-001","uidSubmissionId":"uid-submission-001"},"traceId":"tr_contract_trace_001"}
