{"eventId":"evt_e9cc18e9750cfe1ffc9073ff13aad2ab","eventName":"creator.channel-verified","occurredAt":"2026-07-18T00:00:00.000Z","payload":{"audienceFetchedAt":"2026-07-17T23:55:00.000Z","oauthConnectedAt":"2026-07-17T23:40:00.000Z","policyVersion":"policy-2026-07","verifiedAt":"2026-07-17T23:55:00.000Z","verifiedChannelId":"UCcontract_channel_id_01"},"revision":1,"schemaVersion":"scp.integration-event.v2","source":"portal","subject":{"applicationId":"application-001","portalCreatorId":"creator-001","programId":"program-view-cpm"},"traceId":"tr_contract_trace_001"}
