{"eventId":"evt_7261a123daaf137896bd4dc2dd2d3928","eventName":"uid.guide-email.requested","occurredAt":"2026-07-18T00:00:01.000Z","payload":{"deliveryReason":"initial","locale":"en"},"revision":1,"schemaVersion":"scp.integration-event.v2","source":"portal","subject":{"applicationId":"application-001","campaignId":"campaign-summer","outreachId":"outreach-001","programId":"program-view-cpm","uidGrantId":"uid-grant-001"},"traceId":"tr_contract_trace_001"}
