{"eventId":"evt_17b197874bce90acd845304d25fde367","eventName":"video.submitted","occurredAt":"2026-07-18T00:02:00.000Z","payload":{"canonicalVideoUrl":"https://www.youtube.com/watch?v=abcDEF_123","contentType":"short","gameId":"xp-hero","publishedAt":"2026-07-17T03:00:00.000Z","reportedViews":1200,"title":"XP Hero run","uidPolicy":"required_before_gem","youtubeVideoId":"abcDEF_123"},"revision":1,"schemaVersion":"scp.integration-event.v2","source":"portal","subject":{"applicationId":"application-001","campaignId":"campaign-summer","outreachId":"outreach-001","programId":"program-view-cpm","videoSubmissionId":"video-submission-001","youtubeVideoId":"abcDEF_123"},"traceId":"tr_contract_trace_001"}
