{"eventId":"evt_7d1dfa8050ac1dd47627a4ec817866ea","eventName":"video.view-snapshot.updated","occurredAt":"2026-07-18T00:04:00.000Z","payload":{"collectedAt":"2026-07-18T00:03:30.000Z","reviewStatus":"approved","viewCount":3456},"revision":3,"schemaVersion":"scp.integration-event.v2","source":"flu","subject":{"applicationId":"application-001","campaignId":"campaign-summer","outreachId":"outreach-001","programId":"program-view-cpm","trackingId":"tracking-001","videoSubmissionId":"video-submission-001","youtubeVideoId":"abcDEF_123"},"traceId":"tr_contract_trace_001"}
